{"$schema":"https://json-schema.org/draft/2020-12/schema","title":"Project Supernova Branch Integration v2.5","type":"object","additionalProperties":false,"required":["session_header","task_network_plan_id","cohort_id","integration_id","generation_head_sha","integrator_branch","verification_branch","verification_head_sha","verification_structural_ci_status","runtime_state_id","executive_status","safe_report_refs","task_ledger","issue_ledger","test_ledger","plan_alignment","research_questions","quarantines","costs_regressions_unknowns","calibration_pass","next_action"],"properties":{"session_header":{"type":"object"},"task_network_plan_id":{"const":"0aa341106cfc5b104ab9ca9c2ae116d490a258685e28d26d5435860c53bb12aa"},"cohort_id":{"type":"string"},"integration_id":{"type":"string"},"generation_head_sha":{"type":"string","pattern":"^[0-9a-f]{40}$"},"integrator_branch":{"type":"string"},"verification_branch":{"type":"string"},"verification_head_sha":{"type":"string","pattern":"^[0-9a-f]{40}$"},"verification_structural_ci_status":{"const":"PASS"},"runtime_state_id":{"type":"string"},"executive_status":{"type":"string"},"safe_report_refs":{"type":"array"},"task_ledger":{"type":"array"},"issue_ledger":{"type":"array"},"test_ledger":{"type":"array"},"plan_alignment":{"type":"array"},"research_questions":{"type":"array"},"quarantines":{"type":"array"},"costs_regressions_unknowns":{"type":"object"},"calibration_pass":{"type":"boolean"},"next_action":{"type":"string"}}}
