{
  "session_header": {
    "schema_version": "PS-SESSION-2",
    "session_name": "PS-JOINT-I01 | Evidence Integrator",
    "target_program": "JOINT",
    "phase": "T0",
    "iteration_id": "CAL-BR-006-v251-433ad83a",
    "iteration_number": 6,
    "role_id": "MF06",
    "goal": "Integrate only MM06-verified evidence for the active cohort",
    "plan_id": "0aa341106cfc5b104ab9ca9c2ae116d490a258685e28d26d5435860c53bb12aa",
    "runtime_state_id": "9d0a88cc9001295b5e4c0f4163e83c0fd64ce04521e34230ad3539af14f3dfaf",
    "model_target": "GPT-5.6 Sol",
    "reasoning_effort_target": "EXTRA_HIGH",
    "model_binding_status": "PARTIAL_UNVERIFIED",
    "execution_mode": "SAFE_REPLAY_ONLY",
    "runtime_receipt": {
      "requested_model": "GPT-5.6 Sol",
      "observed_model_family": "GPT-5.6 Sol",
      "reasoning_effort_observed": false,
      "binding_status": "PARTIAL_UNVERIFIED"
    }
  },
  "task_network_plan_id": "0aa341106cfc5b104ab9ca9c2ae116d490a258685e28d26d5435860c53bb12aa",
  "cohort_id": "CAL-BR-006-v251-433ad83a",
  "integration_id": "PS-MF06-CAL-BR-006-v251-433ad83a-DIAGNOSTIC",
  "generation_head_sha": "c86c091c3be840559a46670218705be1277acd8f",
  "integrator_branch": "ps/integrate/CAL-BR-006-v251-433ad83a",
  "verification_branch": "ps/verify/CAL-BR-006-v251-433ad83a",
  "verification_head_sha": "074870ac0f1821051f5b0c31e2770ad4f9bd3192",
  "verification_structural_ci_status": "PASS",
  "runtime_state_id": "9d0a88cc9001295b5e4c0f4163e83c0fd64ce04521e34230ad3539af14f3dfaf",
  "executive_status": "DIAGNOSTIC_INTEGRATION_COMPLETE_ZERO_SAFE_12_QUARANTINED_NONCOUNTABLE_NO_CREDIT_NO_PROMOTION",
  "safe_report_refs": [],
  "task_ledger": [
    {"task":"canonical_pointer_reread","status":"PASS","detail":"main still points to protocol 2.5, expected plan, generation 6 and active non-superseded cohort CAL-BR-006-v251-433ad83a."},
    {"task":"frozen_generation_control_assignment","status":"PASS","detail":"Exact G c86c091c3be840559a46670218705be1277acd8f matches frozen control and assignment lineage, checkpoint and runtime state."},
    {"task":"verifier_receipt_gate","status":"PASS_DIAGNOSTIC","detail":"Exact verifier branch is one commit ahead of G at 074870ac0f1821051f5b0c31e2770ad4f9bd3192 and contains the MM06 receipt."},
    {"task":"verifier_partition","status":"PASS","detail":"MM06 partition is unique/disjoint/exhaustive: SAFE=0, QUARANTINED=12, MISSING=0."},
    {"task":"safe_blob_reread","status":"NOT_APPLICABLE","detail":"No MM06-safe refs exist; MF06 reread zero worker blobs and did not inspect quarantined report contents for admission."},
    {"task":"diagnostic_integration","status":"PASS","detail":"Only verifier-safe evidence set (empty) was integrated; quarantines and verifier findings were preserved without scientific or runtime promotion."},
    {"task":"calibration_credit","status":"FORCED_FALSE","detail":"Frozen control/assignment set calibration_countable=false and repository source policy remains unqualified."}
  ],
  "issue_ledger": [
    {"issue_id":"O-T0-GENERATION-STRUCTURAL-CI","classification":"LIVENESS_DEFECT","severity":"BLOCKING_AT_MM06","status":"HISTORICAL_FAILURE_LATE_SUCCESS_NOT_RETROACTIVE","source_ids":["MM06:O-T0-GENERATION-STRUCTURAL-CI","github-status:c86c091c3be840559a46670218705be1277acd8f"],"detail":"MM06 observed branch-generation=failure and quarantined all reports. MF06 later observes branch-generation=success on the same immutable G, but this late status does not retroactively alter MM06's safe partition."},
    {"issue_id":"O-T0-WORKER-STRUCTURAL-CI","classification":"LIVENESS_DEFECT","severity":"BLOCKING_AT_MM06","status":"0_OF_12_SAFE_AT_VERIFICATION","source_ids":["MM06:O-T0-WORKER-STRUCTURAL-CI"],"detail":"MM06 observed no required worker structural success on exact heads. MF06 does not re-admit or re-verify quarantined workers."},
    {"issue_id":"O-T0-REPO-SOURCE-POLICY","classification":"T0_BLOCKER","severity":"BLOCKING","status":"UNVERIFIED","source_ids":["MM06:O-T0-REPO-SOURCE-POLICY","github:branches/main"],"detail":"GitHub reports main protected=true but required status-check enforcement is off with empty contexts/checks; source-bound repository policy is not established."},
    {"issue_id":"O-T0-NONCOUNTABLE-BOOTSTRAP","classification":"T0_BLOCKER","severity":"BLOCKING_FOR_CREDIT","status":"BY_DESIGN","source_ids":["MM06:O-T0-NONCOUNTABLE-BOOTSTRAP"],"detail":"Generation 6 is immutable non-countable diagnostic history; calibration_pass must remain false."},
    {"issue_id":"O-T0-AUTH-METADATA-DRIFT","classification":"CONTROL_HARDENING","severity":"CONTROL_HYGIENE","status":"OPEN","source_ids":["MM06:O-T0-AUTH-METADATA-DRIFT"],"detail":"Frozen worker_auth metadata retains a legacy scheme label while authoritative branch protocol requires CANONICAL-REPORT-2."},
    {"issue_id":"O-T0-STRICT-SESSION-MODE-GAP","classification":"CONTROL_HARDENING","severity":"HIGH","status":"CONFIRMED","source_ids":["MM06:O-T0-STRICT-SESSION-MODE-GAP"],"detail":"Frozen v2.5.1 structural validator omits session_header.execution_mode from its exact session map; successor countable control must close this gap."},
    {"issue_id":"O-T0-OLDER-VERIFIER-SCHEMA","classification":"CONTROL_HARDENING","severity":"BLOCKING_FOR_COUNTABLE_CALIBRATION","status":"DIAGNOSTIC_ONLY","source_ids":["MM06:O-T0-OLDER-VERIFIER-SCHEMA"],"detail":"Generation 6 verifier schema lacks later temporal PRE_CI/report-admission fields and remains diagnostic only."},
    {"issue_id":"O-T0-SCIENTIFIC-NOT-MEASURED","classification":"SCIENTIFIC_NOT_MEASURED","severity":"NONSCIENTIFIC_BOOTSTRAP","status":"NOT_MEASURED","source_ids":["MM06:plan_alignment","assignment:CAL-BR-006-v251-433ad83a"],"detail":"No fresh/protected/benchmark work was authorized; E1, G1, C1, E3, Mastermind improvement and statement-fidelity claims remain NOT_MEASURED."}
  ],
  "test_ledger": [
    {"test":"active_cohort_not_superseded","result":"PASS","observed":"CAL-BR-006-v251-433ad83a remains active and absent from superseded_cohorts."},
    {"test":"verifier_branch_ancestry","result":"PASS","observed":"verifier branch ahead_by=1, behind_by=0 from exact G; only verification/<cohort>.json added."},
    {"test":"verifier_exact_head_structural_ci","result":"PASS","observed":"supernova/branch-verify=success on 074870ac0f1821051f5b0c31e2770ad4f9bd3192."},
    {"test":"verifier_report_admission","result":"FAIL_OBSERVED_NONCOUNTABLE","observed":"supernova/report-admission=failure on verifier head; preserved as diagnostic admission failure and not used for countable credit."},
    {"test":"mm06_partition_exhaustive","result":"PASS","observed":"SAFE=0, QUARANTINED=12, MISSING=0; all 12 assigned worker IDs accounted for exactly once."},
    {"test":"safe_ref_transport_reread","result":"PASS_VACUOUS_ZERO_SAFE","observed":"No safe refs existed, so no worker blob could be transported into MF06 evidence."},
    {"test":"generation_liveness_late_recheck","result":"PASS_LATE_ONLY","observed":"Current exact G statuses include supernova/branch-generation=success and supernova/static-control=success; late liveness does not rewrite MM06 quarantine decisions."},
    {"test":"repository_source_policy","result":"FAIL","observed":"main protected=true but protection.required_status_checks.enforcement_level=off with zero required contexts/checks."},
    {"test":"calibration_eligibility","result":"FAIL_BY_DESIGN","observed":"calibration_countable=false; calibration_streak remains 0."}
  ],
  "plan_alignment": [
    "Protocol remains exactly 2.5 under plan 0aa341106cfc5b104ab9ca9c2ae116d490a258685e28d26d5435860c53bb12aa.",
    "Generation 6 remains immutable non-countable history; no main/generation/worker/verifier/scientific state was modified by MF06.",
    "MF06 consumed only MM06-safe refs; the safe set was empty and all 12 MM06 quarantines were preserved.",
    "No missing worker was inferred as zero; MM06 explicitly reported missing_workers=[] and quarantined all 12 assigned workers.",
    "Exact verifier structural status is successful; verifier report-admission failure is preserved and is not treated as PASS.",
    "Repository protection/source policy remains blocking for future countable calibration.",
    "Fresh model-sensitive evidence is absent; model binding remains PARTIAL_UNVERIFIED and no promotion is possible.",
    "KERNEL_VALID is not equated with STATEMENT_FIDELITY_CONFIRMED; neither scientific property was measured in this bootstrap.",
    "Benchmark cursors, runtime state, calibration streak and scientific claims remain unchanged; BIL00 alone owns guarded transitions."
  ],
  "research_questions": [],
  "quarantines": [
    {"worker_id":"MF01","head_sha":"d6782b9e39b8f0bffc5317b4d2a0da793608a5af","reason_code":"STRUCTURAL_CI_NOT_SUCCESS","source":"MM06"},
    {"worker_id":"MF02","head_sha":"79b892e638bef9cfa7523c6e938f5c42d5aaca43","reason_code":"STRUCTURAL_CI_NOT_SUCCESS","source":"MM06"},
    {"worker_id":"MF03","head_sha":"482ea7e125fc8e6a7d108a85d98d4cad8538226a","reason_code":"STRUCTURAL_CI_NOT_SUCCESS","source":"MM06"},
    {"worker_id":"MF04","head_sha":"919ea7a2edfda37dc578bb6ccdda5012c2d34278","reason_code":"STRUCTURAL_CI_NOT_SUCCESS","source":"MM06"},
    {"worker_id":"MF05","head_sha":"1d8a3b44beb5fc3ab286390829d5984ae3ca10bb","reason_code":"STRUCTURAL_CI_NOT_SUCCESS","source":"MM06"},
    {"worker_id":"MM01","head_sha":"bbfa5bae05128d170925b797ccd8681e555f24cd","reason_code":"STRUCTURAL_CI_NOT_SUCCESS","source":"MM06"},
    {"worker_id":"MM02","head_sha":"9e1ef90b63bb8a46906d8134ac205447b27b0b10","reason_code":"STRUCTURAL_CI_NOT_SUCCESS","source":"MM06"},
    {"worker_id":"MM03","head_sha":"ef5c71eae939705bf368245b372a276989dc6cf5","reason_code":"STRUCTURAL_CI_NOT_SUCCESS","source":"MM06"},
    {"worker_id":"MM04","head_sha":"49894cfbdd14348b170980035464e303c42b34df","reason_code":"STRUCTURAL_CI_NOT_SUCCESS","source":"MM06"},